good_sentence,bad_sentence,good_cue,bad_cue,critical_region,phenomenon
У меня есть три книги.,У меня есть три книга.,три,три,книга,number_agreement 
Мы видели пять машин.,Мы видели пять машина.,пять,пять,машина,number_agreement 
Он купил две рубашки.,Он купил две рубашка.,две,две,рубашка,number_agreement 
На столе лежат четыре яблока.,На столе лежат четыре яблоко.,четыре,четыре,яблоко,number_agreement
У неё есть много друзей.,У неё есть много друг.,много,много,друг,number_agreement 
Они нашли несколько коробок.,Они нашли несколько коробка.,несколько,несколько,коробка,number_agreement
Я купил одну книгу.,Я купил одну книги.,одну,одну,книги,number_agreement
Мы заказали шесть пицц.,Мы заказали шесть пицца.,шесть,шесть,пицца,number_agreement
Ты видел три стола?,Ты видел три стол?,три,три,стол,number_agreement
На полке стоят семь чашек.,На полке стоят семь чашка.,семь,семь,чашка,number_agreement
Мы заказали шесть рубашки.,Мы заказали шесть рубашка.,шесть,шесть,рубашка,number_agreement
На полке стоят один друг.,На полке стоят один друзья.,один,один,друзья,number_agreement
На столе лежат восемь яблоки.,На столе лежат восемь яблоко.,восемь,восемь,яблоко,number_agreement
На столе лежат десять яблоки.,На столе лежат десять яблоко.,десять,десять,яблоко,number_agreement
Мы видели пять коробки.,Мы видели пять коробка.,пять,пять,коробка,number_agreement
У меня есть четыре коробки.,У меня есть четыре коробка.,четыре,четыре,коробка,number_agreement
На столе лежат семь коробки.,На столе лежат семь коробка.,семь,семь,коробка,number_agreement
На полке стоят три друзья.,На полке стоят три друг.,три,три,друг,number_agreement
На полке стоят семь машины.,На полке стоят семь машина.,семь,семь,машина,number_agreement
Я купил восемь друзья.,Я купил восемь друг.,восемь,восемь,друг,number_agreement
Мы видели две рубашки.,Мы видели две рубашка.,две,две,рубашка,number_agreement
Он купил много коробки.,Он купил много коробка.,много,много,коробка,number_agreement
Мы видели одна друг.,Мы видели одна друзья.,одна,одна,друзья,number_agreement
У меня есть много пиццы.,У меня есть много пицца.,много,много,пицца,number_agreement
Мы видели три пиццы.,Мы видели три пицца.,три,три,пицца,number_agreement
Мы заказали одна книга.,Мы заказали одна книги.,одна,одна,книги,number_agreement
Они нашли две книги.,Они нашли две книга.,две,две,книга,number_agreement
На столе лежат четыре чашки.,На столе лежат четыре чашка.,четыре,четыре,чашка,number_agreement
Он купил три яблоки.,Он купил три яблоко.,три,три,яблоко,number_agreement
Они нашли три столы.,Они нашли три стол.,три,три,стол,number_agreement
На столе лежат девять коробки.,На столе лежат девять коробка.,девять,девять,коробка,number_agreement
На столе лежат одна машина.,На столе лежат одна машины.,одна,одна,машины,number_agreement
У меня есть семь коробки.,У меня есть семь коробка.,семь,семь,коробка,number_agreement
Мы заказали шесть столы.,Мы заказали шесть стол.,шесть,шесть,стол,number_agreement
Ты видел один стол.,Ты видел один столы.,один,один,столы,number_agreement
Ты видел шесть коробки.,Ты видел шесть коробка.,шесть,шесть,коробка,number_agreement
Он купил пять столы.,Он купил пять стол.,пять,пять,стол,number_agreement
Они нашли одну яблоко.,Они нашли одну яблоки.,одну,одну,яблоки,number_agreement
Ты видел три яблоки.,Ты видел три яблоко.,три,три,яблоко,number_agreement
Он купил семь машины.,Он купил семь машина.,семь,семь,машина,number_agreement
Я купил пять коробки.,Я купил пять коробка.,пять,пять,коробка,number_agreement
На полке стоят пять книги.,На полке стоят пять книга.,пять,пять,книга,number_agreement
На полке стоят восемь столы.,На полке стоят восемь стол.,восемь,восемь,стол,number_agreement
На столе лежат две машины.,На столе лежат две машина.,две,две,машина,number_agreement
Мы видели четыре коробки.,Мы видели четыре коробка.,четыре,четыре,коробка,number_agreement
На столе лежат шесть столы.,На столе лежат шесть стол.,шесть,шесть,стол,number_agreement
Они нашли десять коробки.,Они нашли десять коробка.,десять,десять,коробка,number_agreement
Я купил восемь друзья.,Я купил восемь друг.,восемь,восемь,друг,number_agreement
Ты видел семь книги.,Ты видел семь книга.,семь,семь,книга,number_agreement
У неё есть одна рубашка.,У неё есть одна рубашки.,одна,одна,рубашки,number_agreement
Ты видел много машины.,Ты видел много машина.,много,много,машина,number_agreement
Я купил пять чашки.,Я купил пять чашка.,пять,пять,чашка,number_agreement
Мы видели десять яблоки.,Мы видели десять яблоко.,десять,десять,яблоко,number_agreement
Они нашли одну пицца.,Они нашли одну пиццы.,одну,одну,пиццы,number_agreement
Мы заказали один машина.,Мы заказали один машины.,один,один,машины,number_agreement
Ты видел четыре чашки.,Ты видел четыре чашка.,четыре,четыре,чашка,number_agreement
Мы видели одна чашка.,Мы видели одна чашки.,одна,одна,чашки,number_agreement
У неё есть одна рубашка.,У неё есть одна рубашки.,одна,одна,рубашки,number_agreement
Ты видел две машины.,Ты видел две машина.,две,две,машина,number_agreement
На полке стоят семь яблоки.,На полке стоят семь яблоко.,семь,семь,яблоко,number_agreement
Он купил семь машины.,Он купил семь машина.,семь,семь,машина,number_agreement
На полке стоят десять друзья.,На полке стоят десять друг.,десять,десять,друг,number_agreement
Мы заказали девять столы.,Мы заказали девять стол.,девять,девять,стол,number_agreement
На полке стоят один друг.,На полке стоят один друзья.,один,один,друзья,number_agreement
Я купил десять друзья.,Я купил десять друг.,десять,десять,друг,number_agreement
Мы заказали одну коробка.,Мы заказали одну коробки.,одну,одну,коробки,number_agreement
На столе лежат шесть рубашки.,На столе лежат шесть рубашка.,шесть,шесть,рубашка,number_agreement
Ты видел три машины.,Ты видел три машина.,три,три,машина,number_agreement
У неё есть одна пицца.,У неё есть одна пиццы.,одна,одна,пиццы,number_agreement
У меня есть восемь яблоки.,У меня есть восемь яблоко.,восемь,восемь,яблоко,number_agreement
На полке стоят три книги.,На полке стоят три книга.,три,три,книга,number_agreement
Они нашли несколько пиццы.,Они нашли несколько пицца.,несколько,несколько,пицца,number_agreement
Они нашли несколько рубашки.,Они нашли несколько рубашка.,несколько,несколько,рубашка,number_agreement
На столе лежат четыре книги.,На столе лежат четыре книга.,четыре,четыре,книга,number_agreement
Ты видел одна стол.,Ты видел одна столы.,одна,одна,столы,number_agreement
У неё есть девять друзья.,У неё есть девять друг.,девять,девять,друг,number_agreement
На полке стоят шесть чашки.,На полке стоят шесть чашка.,шесть,шесть,чашка,number_agreement
У меня есть восемь рубашки.,У меня есть восемь рубашка.,восемь,восемь,рубашка,number_agreement
Ты видел пять коробки.,Ты видел пять коробка.,пять,пять,коробка,number_agreement
Ты видел одна стол.,Ты видел одна столы.,одна,одна,столы,number_agreement
На столе лежат семь чашки.,На столе лежат семь чашка.,семь,семь,чашка,number_agreement
На полке стоят три коробки.,На полке стоят три коробка.,три,три,коробка,number_agreement
Он купил один друг.,Он купил один друзья.,один,один,друзья,number_agreement
На столе лежат семь яблоки.,На столе лежат семь яблоко.,семь,семь,яблоко,number_agreement
У меня есть семь пиццы.,У меня есть семь пицца.,семь,семь,пицца,number_agreement
Ты видел семь книги.,Ты видел семь книга.,семь,семь,книга,number_agreement
Он купил один рубашка.,Он купил один рубашки.,один,один,рубашки,number_agreement
Они нашли один машина.,Они нашли один машины.,один,один,машины,number_agreement
Мы видели десять книги.,Мы видели десять книга.,десять,десять,книга,number_agreement
На полке стоят пять коробки.,На полке стоят пять коробка.,пять,пять,коробка,number_agreement
Мы заказали много друзья.,Мы заказали много друг.,много,много,друг,number_agreement
У неё есть девять машины.,У неё есть девять машина.,девять,девять,машина,number_agreement
Ты видел три коробки.,Ты видел три коробка.,три,три,коробка,number_agreement
Ты видел шесть яблоки.,Ты видел шесть яблоко.,шесть,шесть,яблоко,number_agreement
На столе лежат семь пиццы.,На столе лежат семь пицца.,семь,семь,пицца,number_agreement
Я купил две машины.,Я купил две машина.,две,две,машина,number_agreement
Он купил одна яблоко.,Он купил одна яблоки.,одна,одна,яблоки,number_agreement
Он купил шесть рубашки.,Он купил шесть рубашка.,шесть,шесть,рубашка,number_agreement
Они нашли одну машина.,Они нашли одну машины.,одну,одну,машины,number_agreement
На полке стоят восемь друзья.,На полке стоят восемь друг.,восемь,восемь,друг,number_agreement
На полке стоят восемь друзья.,На полке стоят восемь друг.,восемь,восемь,друг,number_agreement
У неё есть две друзья.,У неё есть две друг.,две,две,друг,number_agreement
Я купил несколько чашки.,Я купил несколько чашка.,несколько,несколько,чашка,number_agreement
На столе лежат девять машины.,На столе лежат девять машина.,девять,девять,машина,number_agreement
Он купил три друзья.,Он купил три друг.,три,три,друг,number_agreement
Он купил много друзья.,Он купил много друг.,много,много,друг,number_agreement
У неё есть несколько коробки.,У неё есть несколько коробка.,несколько,несколько,коробка,number_agreement
Ты видел десять коробки.,Ты видел десять коробка.,десять,десять,коробка,number_agreement
На столе лежат семь яблоки.,На столе лежат семь яблоко.,семь,семь,яблоко,number_agreement
Мы заказали девять столы.,Мы заказали девять стол.,девять,девять,стол,number_agreement
Ты видел десять коробки.,Ты видел десять коробка.,десять,десять,коробка,number_agreement
У меня есть много друзья.,У меня есть много друг.,много,много,друг,number_agreement
У неё есть две чашки.,У неё есть две чашка.,две,две,чашка,number_agreement
Ты видел три чашки.,Ты видел три чашка.,три,три,чашка,number_agreement
Он купил девять столы.,Он купил девять стол.,девять,девять,стол,number_agreement
На столе лежат пять рубашки.,На столе лежат пять рубашка.,пять,пять,рубашка,number_agreement
Они нашли несколько чашки.,Они нашли несколько чашка.,несколько,несколько,чашка,number_agreement
У меня есть десять яблоки.,У меня есть десять яблоко.,десять,десять,яблоко,number_agreement
Мы заказали пять пиццы.,Мы заказали пять пицца.,пять,пять,пицца,number_agreement
У неё есть шесть машины.,У неё есть шесть машина.,шесть,шесть,машина,number_agreement
Они нашли четыре друзья.,Они нашли четыре друг.,четыре,четыре,друг,number_agreement
Я купил две пиццы.,Я купил две пицца.,две,две,пицца,number_agreement
На полке стоят семь яблоки.,На полке стоят семь яблоко.,семь,семь,яблоко,number_agreement
Я купил десять коробки.,Я купил десять коробка.,десять,десять,коробка,number_agreement
Мы видели одна стол.,Мы видели одна столы.,одна,одна,столы,number_agreement
Он купил одна машина.,Он купил одна машины.,одна,одна,машины,number_agreement
У неё есть несколько пиццы.,У неё есть несколько пицца.,несколько,несколько,пицца,number_agreement
У неё есть пять рубашки.,У неё есть пять рубашка.,пять,пять,рубашка,number_agreement
Я купил три столы.,Я купил три стол.,три,три,стол,number_agreement
На полке стоят четыре рубашки.,На полке стоят четыре рубашка.,четыре,четыре,рубашка,number_agreement
Мы заказали много пиццы.,Мы заказали много пицца.,много,много,пицца,number_agreement
Мы видели одну книга.,Мы видели одну книги.,одну,одну,книги,number_agreement
Он купил четыре рубашки.,Он купил четыре рубашка.,четыре,четыре,рубашка,number_agreement
У меня есть четыре чашки.,У меня есть четыре чашка.,четыре,четыре,чашка,number_agreement
У меня есть четыре чашки.,У меня есть четыре чашка.,четыре,четыре,чашка,number_agreement
На полке стоят две машины.,На полке стоят две машина.,две,две,машина,number_agreement
Ты видел четыре рубашки.,Ты видел четыре рубашка.,четыре,четыре,рубашка,number_agreement
На столе лежат пять коробки.,На столе лежат пять коробка.,пять,пять,коробка,number_agreement
Ты видел одну стол.,Ты видел одну столы.,одну,одну,столы,number_agreement
У меня есть четыре яблоки.,У меня есть четыре яблоко.,четыре,четыре,яблоко,number_agreement
Мы видели десять коробки.,Мы видели десять коробка.,десять,десять,коробка,number_agreement
Он купил одна друг.,Он купил одна друзья.,одна,одна,друзья,number_agreement
У неё есть много столы.,У неё есть много стол.,много,много,стол,number_agreement
Ты видел восемь коробки.,Ты видел восемь коробка.,восемь,восемь,коробка,number_agreement
Я купил три рубашки.,Я купил три рубашка.,три,три,рубашка,number_agreement
На столе лежат четыре яблоки.,На столе лежат четыре яблоко.,четыре,четыре,яблоко,number_agreement
Он купил одна машина.,Он купил одна машины.,одна,одна,машины,number_agreement
На столе лежат две книги.,На столе лежат две книга.,две,две,книга,number_agreement
Я купил семь книги.,Я купил семь книга.,семь,семь,книга,number_agreement
На полке стоят две рубашки.,На полке стоят две рубашка.,две,две,рубашка,number_agreement
Мы видели пять чашки.,Мы видели пять чашка.,пять,пять,чашка,number_agreement
Они нашли семь коробки.,Они нашли семь коробка.,семь,семь,коробка,number_agreement
На полке стоят четыре чашки.,На полке стоят четыре чашка.,четыре,четыре,чашка,number_agreement
У меня есть две пиццы.,У меня есть две пицца.,две,две,пицца,number_agreement
Они нашли несколько столы.,Они нашли несколько стол.,несколько,несколько,стол,number_agreement
Он купил пять коробки.,Он купил пять коробка.,пять,пять,коробка,number_agreement
Они нашли десять рубашки.,Они нашли десять рубашка.,десять,десять,рубашка,number_agreement
Мы заказали одну чашка.,Мы заказали одну чашки.,одну,одну,чашки,number_agreement
Ты видел несколько яблоки.,Ты видел несколько яблоко.,несколько,несколько,яблоко,number_agreement
На столе лежат десять друзья.,На столе лежат десять друг.,десять,десять,друг,number_agreement
У неё есть одна яблоко.,У неё есть одна яблоки.,одна,одна,яблоки,number_agreement
Он купил семь друзья.,Он купил семь друг.,семь,семь,друг,number_agreement
Мы видели две столы.,Мы видели две стол.,две,две,стол,number_agreement
На столе лежат несколько чашки.,На столе лежат несколько чашка.,несколько,несколько,чашка,number_agreement
У неё есть один книга.,У неё есть один книги.,один,один,книги,number_agreement
Мы заказали три яблоки.,Мы заказали три яблоко.,три,три,яблоко,number_agreement
У неё есть много друзья.,У неё есть много друг.,много,много,друг,number_agreement
Мы видели десять столы.,Мы видели десять стол.,десять,десять,стол,number_agreement
Ты видел четыре пиццы.,Ты видел четыре пицца.,четыре,четыре,пицца,number_agreement
У меня есть две пиццы.,У меня есть две пицца.,две,две,пицца,number_agreement
У меня есть семь книги.,У меня есть семь книга.,семь,семь,книга,number_agreement
Мы заказали одну друг.,Мы заказали одну друзья.,одну,одну,друзья,number_agreement
Он купил одну яблоко.,Он купил одну яблоки.,одну,одну,яблоки,number_agreement
Ты видел две машины.,Ты видел две машина.,две,две,машина,number_agreement
У меня есть две коробки.,У меня есть две коробка.,две,две,коробка,number_agreement
У неё есть три рубашки.,У неё есть три рубашка.,три,три,рубашка,number_agreement
На столе лежат несколько пиццы.,На столе лежат несколько пицца.,несколько,несколько,пицца,number_agreement
У неё есть три машины.,У неё есть три машина.,три,три,машина,number_agreement
Мы заказали одна машина.,Мы заказали одна машины.,одна,одна,машины,number_agreement
На столе лежат восемь машины.,На столе лежат восемь машина.,восемь,восемь,машина,number_agreement
Мы видели три пиццы.,Мы видели три пицца.,три,три,пицца,number_agreement
Он купил три столы.,Он купил три стол.,три,три,стол,number_agreement
У неё есть много коробки.,У неё есть много коробка.,много,много,коробка,number_agreement
Я купил пять столы.,Я купил пять стол.,пять,пять,стол,number_agreement
На столе лежат семь друзья.,На столе лежат семь друг.,семь,семь,друг,number_agreement
На столе лежат одна пицца.,На столе лежат одна пиццы.,одна,одна,пиццы,number_agreement
У неё есть семь машины.,У неё есть семь машина.,семь,семь,машина,number_agreement
Я купил много рубашки.,Я купил много рубашка.,много,много,рубашка,number_agreement
